{
  "version": 1,
  "source_id": "caviar_meet_walk_split_mws1gt_cvml",
  "asset_kind": "dataset_archive",
  "canonical_url": "https://homepages.inf.ed.ac.uk/rbf/CAVIARDATA1/Meet_WalkSplit/mws1gt.xml",
  "accessed_on": "2026-08-10",
  "source_revision": "last_modified_2005-10-07",
  "upstream_name": "CAVIAR Meet_WalkSplit hand-labelled CVML ground truth",
  "license": {
    "name": "Creative Commons Attribution-ShareAlike (version unspecified by publisher)",
    "spdx_id": null,
    "terms_url": "https://homepages.inf.ed.ac.uk/rbf/CAVIARDATA1/",
    "commercial_use": "allowed",
    "modification": "allowed",
    "redistribution": "allowed"
  },
  "access": {
    "gated": "no",
    "authentication_required": "no",
    "expected_bytes": 2714967
  },
  "content": {
    "observed_bytes": 2714967,
    "sha256": "a3f76c5f9539d9bff4730863d503ce979c5dfe5e9595689578eedd4d6bbd790b"
  },
  "privacy": {
    "real_minors": "no",
    "faces": "not_applicable",
    "audio": "not_applicable",
    "device_or_account_ids": "no",
    "precise_timestamps": "no",
    "private_household_data": "no"
  },
  "labels": {
    "origin": "human_nonexpert",
    "human_verified": true,
    "ground_truth": true
  },
  "admission": {
    "tier": "B",
    "status": "verified_local",
    "purpose": "model_evaluation",
    "requires_user_approval": false,
    "user_approval_recorded": false,
    "git_allowed": false,
    "ci_allowed": false,
    "redistribution_allowed": false,
    "training_allowed": false,
    "reviewed_on": "2026-08-10",
    "blocker_codes": [],
    "restriction_codes": [
      "adult_human_trajectory_labels",
      "attribution_required",
      "license_version_unspecified",
      "local_only",
      "no_training",
      "sharealike_required"
    ]
  }
}
